{
  "contract": "star-armada/model-manifest",
  "contract_major": 1,
  "asset": "prototype:legions_redesign/defense_platform",
  "revision": "996a6ce37305e41e99d6edc021f91b38b29d95b6af468fa255a436a4cdd2b50e",
  "display_name": "Legions Defense Platform — pending appearance review",
  "files": {
    "mesh": {
      "path": "assets/models/defense_platform.mesh.json",
      "sha256": "ecc6628394412016107c19dc242c555a2626da9016151bdf89c070d13595b27f",
      "bytes": 226445
    }
  },
  "export": {
    "contract": "star-armada/mesh-export",
    "contract_major": 1
  },
  "coordinates": "X beam; Y up; +Z forward",
  "pivot": [
    0,
    0,
    0
  ],
  "bounds": {
    "min": [
      -50.1540947,
      -8.3875284,
      -31.2329216
    ],
    "max": [
      50.1540947,
      16.5315285,
      55.6365204
    ]
  },
  "nominal_scale": 1.0,
  "roles": [
    "accent",
    "base",
    "cool",
    "dark",
    "lit",
    "trim"
  ],
  "provenance": {
    "author": "Lukasz Jawor / STAR ARMADA",
    "tool": "Blender",
    "tool_version": "5.0.1",
    "license": "original",
    "notes": "Original Legions redesign. Script-authoritative build_legions_redesign.py and dedicated design modules; editable masters in art/blender. Complete faction redesign pending owner appearance approval. No simulation, scale or balance changes."
  },
  "requires": {
    "min_engine": "0.15.1",
    "material_profile": "core:fleet/standard"
  },
  "budgets": {
    "triangles": 3708,
    "draw_calls": 6,
    "texture_bytes": 0
  }
}
