{
  "contract": "star-armada/model-manifest",
  "contract_major": 1,
  "asset": "core:alliance/battleship",
  "revision": "7634f9edda51e6a87a50cfbcf697e914ae0f94ba16f0aab6eb59a939214ed7d9",
  "display_name": "Alliance battleship (approved)",
  "files": {
    "mesh": {
      "path": "assets/models/alliance_battleship.mesh.json",
      "sha256": "0a4e397d5c0b60f70fbba35f3e4f4a5ac997ac4de079f821f8f29db9872c95cd",
      "bytes": 743439
    }
  },
  "export": {
    "contract": "star-armada/mesh-export",
    "contract_major": 1,
    "legacy_schema_int": 1
  },
  "coordinates": "X beam; Y up; +Z forward",
  "pivot": [
    0,
    0,
    0
  ],
  "bounds": {
    "min": [
      -73.349998,
      -31.0,
      -143.5
    ],
    "max": [
      73.349998,
      61.0,
      135.0
    ]
  },
  "nominal_scale": 1.0,
  "roles": [
    "accent",
    "base",
    "cool",
    "dark",
    "lit",
    "trim"
  ],
  "provenance": {
    "author": "Lukasz Jawor",
    "tool": "Blender",
    "tool_version": "Blender evaluated bevel mesh",
    "license": "original",
    "source": "art/blender/alliance_battleship.blend",
    "notes": "Migrated from the specimen export that shipped in the S00 preservation checkpoint. The payload still declares the legacy integer 'schema': 1; the loader accepts it during the declared migration window (see art/manifests/decisions.md, D-07)."
  },
  "requires": {
    "min_engine": "0.15.1",
    "material_profile": "core:fleet/standard"
  },
  "budgets": {
    "triangles": 8701,
    "draw_calls": 6,
    "texture_bytes": 0
  },
  "approval": {
    "status": "approved",
    "decision_id": "s06-battleship-hull-detail-2026-10-16",
    "decided_by": "owner",
    "decided_on": "2026-10-16",
    "reviewed_revision": "7634f9edda51e6a87a50cfbcf697e914ae0f94ba16f0aab6eb59a939214ed7d9",
    "reviewed_evidence": [
      "artifacts/battleship_hull_detail/README.md",
      "artifacts/battleship_hull_detail/before-after-review.png",
      "artifacts/battleship_hull_detail/comparison.json"
    ]
  }
}
