{
  "contract": "star-armada/model-manifest",
  "contract_major": 1,
  "asset": "core:alliance/shipyard",
  "revision": "89aa69f2d591c5d1dd180a1599d473268cef64e3acdf0364e05f6ff896c9ccf7",
  "display_name": "Alliance shipyard (approved)",
  "files": {
    "mesh": {
      "path": "assets/models/alliance_shipyard.mesh.json",
      "sha256": "67d4db64c8677a8898f74d6e966a1b2476ffc721fd72c363ddbc992360630aaf",
      "bytes": 505314
    }
  },
  "export": {
    "contract": "star-armada/mesh-export",
    "contract_major": 1,
    "legacy_schema_int": 1
  },
  "coordinates": "X beam; Y up; +Z forward",
  "pivot": [
    0,
    0,
    0
  ],
  "bounds": {
    "min": [
      -55.700001,
      -17.0,
      -46.5
    ],
    "max": [
      55.700001,
      39.400002,
      51.0
    ]
  },
  "nominal_scale": 1.0,
  "roles": [
    "accent",
    "base",
    "cool",
    "dark",
    "lit",
    "trim"
  ],
  "provenance": {
    "author": "Lukasz Jawor",
    "tool": "Blender",
    "tool_version": "Blender evaluated bevel mesh",
    "license": "original",
    "source": "art/blender/alliance_shipyard.blend",
    "notes": "Migrated from the specimen export that shipped in the S00 preservation checkpoint. The payload still declares the legacy integer 'schema': 1; the loader accepts it during the declared migration window (see art/manifests/decisions.md, D-07)."
  },
  "requires": {
    "min_engine": "0.15.1",
    "material_profile": "core:fleet/standard"
  },
  "budgets": {
    "triangles": 7935,
    "draw_calls": 6,
    "texture_bytes": 0
  },
  "approval": {
    "status": "approved",
    "decision_id": "approved-trio-2026-10-16",
    "decided_by": "owner",
    "decided_on": "2026-10-16",
    "reviewed_revision": "89aa69f2d591c5d1dd180a1599d473268cef64e3acdf0364e05f6ff896c9ccf7",
    "reviewed_evidence": [
      "artifacts/alliance_blender_trio/before-after-contact-sheet.jpg",
      "artifacts/alliance_blender_trio/candidate/initial-yard-tactical.png"
    ]
  }
}
